7 de novembro de 2017,50,Almoço execurivo,Fui atendido pelo garçons alessandra e mutilou que nos surpreenderam Parabéns por profissionais tão gentis.
7 de novembro de 2017,50,Ótimo atendimento!,Vim para comemorar o aniversário de uma amiga e fomos muito bem atendidas pelo Fábio! Muito cortês e ágil. Comida de excelente qualidade.
7 de novembro de 2017,50,Almoço entre amigos,"Fomos bem atendidos pelo Fábio, a comida veio quente e foi rápido. Uma boa música ambiente que não deveria ser cobrado couver."
7 de novembro de 2017,50,atendimento,"atendimento impecável, um exemplo de cordialidade e destreza, fui atendido com uma classe sem igual, recomendo a qualquer viajante uma visita ao restaurante e ainda por cima, ressalto o trabalho dos garçons Murilo e Alisson que se portaram como verdadeiros cavalheiros durante minha refeiçao."
7 de novembro de 2017,50,Comida,Top muito bom lá recomendo a todos os amigos q tem um bom gosto tudo muito bom e organizado sem mais comentários
7 de novembro de 2017,50,Ótimos momentos junto com a minha família...,"Fomos no aniversário do meu sobrinho e fomos muito bem recebidos, a comida é deliciosa e a estrutura do parquinho para os pimpolhos é excelente...."
7 de novembro de 2017,50,Comida e atendimento de alta qualidade,"O restaurante mais agradável de Fortaleza. Atendimento muito bom, garçom Jose Rafael, melhor garçom. Vários pratos, todos muito bom, e sobremesas diferenciadas."
7 de novembro de 2017,50,Sempre uma boa experiência,"Comida excelente, como todos os restaurantes da rede. Muito amplo, com vários ambientes. Recomendamos os pratos com camarão!"
7 de novembro de 2017,40,"Bom, mas não surpreendente!","Comida boa, mas pela fama esperava mais. Bom atendimento e ótimo ambiente! O visual da beira mar vale a visita."
7 de novembro de 2017,50,Mais que aprovado!!,"excelente ambiente, atendimento rápido e cardápio bom... Tanto é bom para um happy hour como para ir jantar com a família..."
7 de novembro de 2017,40,Almoço de domingo em família,"Restaurante espaçoso, com local bem estruturado para crianças e comida deliciosa e variada preço justo e garçons atenciosos."
7 de novembro de 2017,50,Sempre bom,"Coco Bambu tem um ótimo atendimento, lugar agradável e comida boa. Comemos o camarão internacional, uma delícia."
7 de novembro de 2017,40,Ambiente muito bom.,"Ambiente muito agradável, estacionamento amplo e serviço bom. A comida é boa. Só acho ruim uma coisa, e não depende da casa, nas datas comemorativas fica lotado demais. Isso prova a qualidade da casa. Recomendadissimo."
7 de novembro de 2017,50,Ótimo Custo Benefício,"Restaurante não é barato em si, mas os pratos são muito bem servidos e muito bem preparados, o que torna um excelente custo benefício. Ótima opção de parquinho (pago) para crianças."
7 de novembro de 2017,50,Aniversario Perfeito,"Tudo muito bom, atendimento, maravilhoso, Adorei,comidas gostosas ,musica boa e ambiente super limpo."
7 de novembro de 2017,50,Boas companhias alinhado à boa comida,"Excelente atendimento, comida (janta e sobremesa) e, principalmente, um parquinho infantil onde as crianças se divertem, enquanto os adultos tb se divertem cada a seu modo."
7 de novembro de 2017,50,Qualidade de primeira,"O coco bambu é sem duvida o melhor restaurante de Fortaleza. Pelo conjunto da entrega: comida boa, conforto, serviço. Diversas vezes que escolhi outro restaurante, senti arrependimento por não ter ido, por mais uma vez, no coco bambu."
6 de novembro de 2017,50,Reunião de amigos!!!,"Lugar agradável com cardápio maravilhoso e atendimento diferenciado. Ambiente acolhedor, amplo e de bom gosto!"
6 de novembro de 2017,50,Família,"Excelente local, receptivo e com uma grande variedade de cardápio, atendimento privilegiado, é ótimo local para comer."
6 de novembro de 2017,50,Ótimo,"Ótimo atendimento e pratos deliciosos ,um excelente ambiente ,uns drinks maravilhoso .um excelente lugar pra qualquer ocasião 😘"
6 de novembro de 2017,50,Eu adoro!,"É impressionante como podemos comer qualquer prato em um único lugar. O Coco Bambu não tem somente frutos do mar e peixes, mas também carnes, crepes, pizzas, saladas... cardápio muito variado e atendimento sempre cordial. Fomos atendidos pelo Sr. José, muito atencioso, eficiente e simpático."
6 de novembro de 2017,50,Familia,"Comida maravilhosa, ambiente super agradável,recomendo! Só chamo atenção para os finais de semana que enche demais e tem fila de espera, apesar do espaço ser grande."
6 de novembro de 2017,50,Aniversario do meu filho,Comida otima e atendimento rapido e dinamico. Os garçons Guilherme e Romulo foram muito simpáticos e prestativos.
6 de novembro de 2017,50,jantar em família,Hermivan muito atencioso e com um excelente atendimento. a comida chegou rápido e com o pedido correto.
6 de novembro de 2017,50,Jantar família,"Atendimento excelente do Hermivan, muito atencioso.. Comida fresquinha e maravilhosa. O pedido chegou rápido e correto"
6 de novembro de 2017,50,Coco Bambu Sul ambiente show,Lugar bem agradável com seu atendimento perfeito. Comida gostosa e toda certinha que já contamos e conhecemos. Para aquela refeição sem erro. O lugar é esse.
6 de novembro de 2017,50,Ótima comida,"lugar bastante agradável, com ambientes diversos, comida excelente, atendimento prestativo, o camarão internacional e o pudim são reconhecidamente as opções que recomendo."
6 de novembro de 2017,40,Excelente atendimento e cardápio.,"Também é um excelente ambiente para comemorações, sempre usamos para encontro com amigos e familiares em datas comemorativas, como aniversário."
6 de novembro de 2017,50,Muito bom,"Alem da localização ser muito boa a gastronomia é excelente. Gostei bastante, voltarei e indico aos amigos."
6 de novembro de 2017,50,Coco Bambu Sul - EXCELENTE,"Ambiente excelente, comida maravilhosa a um preço convidativo faz deste Restaurante um local que você tem vontade de voltar sempre!!! O atendimento é excelente e mesmo lotado, o tempo de espera é mínimo. O garçom Cleber faz a diferença com sua atenção dedicada!"
6 de novembro de 2017,40,Boa pizza,"Restaurante bom! Há milhões de opções de pratos, para todos os gostos! A pizza é uma delicia e a pequena serve bem duas pessoas (sobrou pro café da manhã!). O atendimento muito bom, rápido e eficiente. Um bom custo beneficio!"
5 de novembro de 2017,50,Almocço,Fomos almoça no Coco bambu sul e fomos bem atendatendidos pelos garçons Germano e Pereira. Ótimo parquinho..
5 de novembro de 2017,50,Ambiente excelente!,"Ambiente muito agradável, comida fantástica e atendimento impecável pelos garçons Araujo e Moura. Recomendamos o restaurante!"
5 de novembro de 2017,50,"Excelente atendimento, assim como também pratos servidos","Atendimento realizado pelo Garço Nonato, Prato escolhido foi o carne de sol sertaneja, porém prato recomendo seria o camarão Internacional."
5 de novembro de 2017,50,Almoço em Família,"Fomos muito bem atendidos, nosso domingo em família ficou ainda melhor. Pessoas assim que facilitam nosso dia a dia Obrigada aos funcionários PEREIRA e GERMANO que foram notal Mil !!!!"
4 de novembro de 2017,50,Atendimento,"O Garçom Murilo, foi bastante atencioso. A pizza de frango com catupiry é bastante recheada e deliciosa. E os churros de doce de leite como sobremesa são deliciosos."
4 de novembro de 2017,50,Atendimento,Ótimo atendimento. As comidas estavam ótimas e o atendimento do garçom foi excelente. Recomendo. Fortemente
4 de novembro de 2017,50,Excelente,Comida e atendimento excelente dos garçons Darlan e José (Zé). Um ambiente excelente para todos os eventos.
4 de novembro de 2017,40,Aniversário,"Tudo muito bom. Fui atendida pelo Silva!! Comida muito gostoso, ambiente aconchegante. Música boa..."
4 de novembro de 2017,50,Atendimento,"Garçon Murilo e Celio, otimo atendimento. Recomendo! Boa comida saborosa e ambiente aconchegante volto novamente."
4 de novembro de 2017,50,Atendimento,"Garçom Murilo e Célio atenderam muito bem, atenciosos e tempestivos! Ótima comida, excelente ambiente!"
4 de novembro de 2017,50,Atendimento,"Ótimo atendimento. Celso, Murilo, henrique, cleber e darlan. Comida maravilhosa, ambiente agradavel.."
4 de novembro de 2017,50,Atendimento,"Serviço de qualidade, atendimento ótimo e bastante atenciosos, em especial os garçons Darlan, Murilo, Cleber, Celso! Muito bom!"
4 de novembro de 2017,50,Atendimento,"Fui bem atendida por esses garçons Celso, Cleber, Henrique, Murilo e Darlan no casamento da minha Amiga."
4 de novembro de 2017,50,Atendimento,"Celso, Murilo, Cleber, Henrique, Darlan.. Ótimo atendimento dos funcionários, altamente atenciosos.."
4 de novembro de 2017,50,Muito bom,Local muito bom e gostoso para levar a família. Atendido pelo Moura e o Araújo. Comida muito boa e atendentes muito bem preparados!
3 de novembro de 2017,50,Maravilhoso,Aqui a comida é maravilhosa e o atendimento perfeito! O Fábio e o Márcio são garçons maravilhosos ! Amo tudo aqui
3 de novembro de 2017,50,Jantar,"Ambiente aconchegante, comida boa, drinks e sobremesa excepcional e um ótimo atendimento do Neuton e Murilo."
3 de novembro de 2017,50,Jantar,"Uma ótima recepção, atenção, um ótimo ambiente, ótima comida. Um excelente garçom com grandes capacidade. Neuton e Murilo"
3 de novembro de 2017,50,Atendimento,"Garçom Murilo, Neuton e Célio excelente atendimento, ambiente muito bom e a comida excelente, recomendo"
3 de novembro de 2017,50,Atendimento excelente,"Gostaria de registrar além da diversidade de pratos, o atendimento. Além disso, a cocada de forno é sensacional."
3 de novembro de 2017,50,Happy Hour,"Excelente atendimento, com garçom muito prestativo que deixou a mesa sempre bem servida. A comida estava deliciosa e chegou rapidamente. Super recomendo!"
3 de novembro de 2017,50,O melhor happy hour,"Cervejas em dobro e entradas com 25% de desconto, com ótimo atendimento do Garçon Henrique e do maitre Maciel. Recomendo de entrada o camarões Recife que é fantástico."
2 de novembro de 2017,50,Jantar,"Achei ótimo, atendimento excelente! Muito bom para todos os públicos pois tem playgraund pra crianças e o ambiente eh excelente, limpo, organizado música agradável e culinária extraordinária! Cervejas exóticas excelentes! Adorei o atendimento do garçom Germano!"
2 de novembro de 2017,50,Jantar,Atendimento maravilhoso do Alisson e Germano! Muito atenciosos ! Gostei da musica e tb da manta e cadeira acolchoada para uma criança nossa dormir que o Alisson providenciou.
2 de novembro de 2017,50,Jantar em família,"Prato excelente, atendimento tambem! Restaurante super agradável e aconchegante. Garçons : Tiago e Henrique."
2 de novembro de 2017,50,Jantar,"Bom restaurante, com um cardápio bem diversificado, garçons atenciosos o Germano e Renam fizeram de nossa estada um momento agradável com sua presteza no servir. Espaço Kid’s maravilhoso."
2 de novembro de 2017,50,jantar em família,"muito bom o atendime, comida chegou rápida e bem quentinha. o ambiente super agradável, os garçons super atenciosos. ameiii (:kk garçom tiago e neuton"
2 de novembro de 2017,50,Atendimento excelente,"Feriado em amigo fomos ater o restaurante coco bambu e tivemos otimo atendimento do Garcon Murilo que e muito atencioso cimpatico e nos deu otimas opçoes,voltarei mais vezes e com certeza o proculrarei ele parabens Murilo vc e um otimo garson.."
2 de novembro de 2017,40,Execelente,"Murilo e Renan, muito bom atendimento. Comida maravilhosa. Ambiente muito agradável!!!! Super recomendo!!!"
2 de novembro de 2017,50,Atendimento,Garçom Murilo: excelente atendimento. Atencioso e educado. Pedidos feitos com agilidade. Adoramos e retornaremos.
2 de novembro de 2017,50,Atendimento,"Garçom Murilo, Renan e Alisson.... excelente atendimento. Atencioso e sempre disponível a ajudar. Nota fiscal 1000! 💥💥💥"
2 de novembro de 2017,50,Muito bom atendimento e produto,"Tudo muito bom o Germano e Berg Atendimento nota 100, música muito boa, agradável tempero do prato não muda, inigualável e principalmente a cerva Geladiiiiiiisima e servida a todo instante."
2 de novembro de 2017,50,Almoço em familia,Ambiente muito bom e atendimento do garçom Fábio é sensacional. Vinho muito bom. Música ao vivo e espaço para crianças.
2 de novembro de 2017,50,Celebrando a vida!,"Nota 10!!!! Meu xará, Fábio, sempre nos atende super bem! Ambiente agradável, música boa e preço razoável."
2 de novembro de 2017,40,Almoço excelente,"Exclenete atendimento. Garçom José, Newton . Equite show. Comida boa, local super aconchegante. Super indico!"
2 de novembro de 2017,50,Aniversário com amigas,Comida maravilhosa ambiente muito agradável espaço kids uns dos melhores que eu já vie.. melhor de tudo o atendimento do garçom Barbosa muito atencioso conosco.. está de parabéns
2 de novembro de 2017,50,Excelente para família,"Excelente comida e muito bem atendido pelo Germano que foi muito atencioso e prestativo. O preço não é muito barato, porém é proporcional a qualidade do serviço ofertado. Certamente o play para as crianças é um diferencial positivo."
1 de novembro de 2017,50,Lugar excelente. Ambiente incomparável.,"A comida estava maravilhosa, no lugar indescritível de sempre. Referência elogiosa para Alisson e Germano. Uma noite inesquecível de comemoração."
1 de novembro de 2017,50,Jantar,"Melhor Garçons Germano e José, procurem sempre esses garotos se garagem e fazem com excelência. ;) Nota 1.0000"
1 de novembro de 2017,50,Atendimento,"Garçom murilo e célio, muito bacana, atendimento rápido e comida excelente. O restaurante tá precisando ir para BH/MG!rs!mto bom!"
1 de novembro de 2017,50,Jantar regado a camarão,"Ambiente muito agradável, com música ao vivo e atendimento da melhor qualidade. Ser falar da comida, rápida e inigualavelmente apetitosa. Especial agradecimento aos garçons José e Germano, que nos atenderam super bem!"
1 de novembro de 2017,50,Excelente,Garçom Murilo e Celio. Atendimento pontual e muito cortês! Comida de alta qualidade. Recomendado...!
1 de novembro de 2017,50,Garçom moura,"Ótimo atendimento garçom Moura. Muito educado e simpático, prestativo e rapido. Merece elogios e bonificações"
1 de novembro de 2017,50,Atendimento,Avaliacao garcon murilo e celio. Restaurante com comida de qualidade e atendimento excelente........
1 de novembro de 2017,50,Excelente,"Excelente atendimento de todos em especial do garçom Pereira Martins, comida e ambiente com música ao vivo. Muito agradável. Comemorei meu aniversário hj com minha família e adorei. Muitob recebida."
31 de outubro de 2017,50,Mto bom,"Fomos atendidos pelo alisson e romulo, muito atenciosos! Experiência ótima, ambiente agradável e comida muito gostosa"
31 de outubro de 2017,50,Atendimento Germano,"Refeição muito farta aqui no coco bambu sul! Nao sabia mas agora tem musica ao vivo, muito bom cantor marcelo, agradeço ao garcon Germano."
31 de outubro de 2017,50,Jantar,"Muito bom, música bem agradável, ambiente maravilhoso, em relação a iluminação do local: maravilhosa, comida muito boa, decoração linda. Garçons: -Germano -Barbosa"
31 de outubro de 2017,50,Aniversário,"O atendimento, como sempre excelente, fui atendida pelos garçons Leandro e Moura e foram super simpáticos e prestativos. Indico."
31 de outubro de 2017,50,Jantar,"Fui atendido pelo garçom Alisson. Com atendimento muito bom, ambiente muito agradável, Boa musica..."
31 de outubro de 2017,50,Atendimento,"Garçom Murilo muito atencioso, comida excelente, ambiente agradável música agradável ótima caipirinha"
31 de outubro de 2017,50,Jantar,Sempre muito bom...ambiente agradavel e aconchegante...cardapio completo...amo.... garçons Germano e Pereira
31 de outubro de 2017,50,Jantar,"Ótimo ambiente, garçons excelentes principalmente o germano e pereiraedição impecável , música ambiente tranquilo e agradável"
31 de outubro de 2017,50,Excelente,Excelente atendimento do garçom Pereira e Germano. Parabéns pelo atendimento!!! Todos os garçons são super atenciosos.
31 de outubro de 2017,50,Jantar,Atendimento top dos garçons Germano e parreira. Comida excelente e uma Boa musica ao vivo.. nota 1000
31 de outubro de 2017,50,Aniversário da esposa,O atendimento foi excelente pelo garçom Newton. A comida é simplesmente perfeita e o ambiente muito agradável. Vale a pena conhecer.
31 de outubro de 2017,40,O atendimento.,"O atendimento foi muito bom e com muita atenção a nossa comemoração de aniversário. Exelente a atenção aos garçons Pereira, Barbosa e Germano."
31 de outubro de 2017,40,Avaliação,"Comida muito boa mesmo, cardápio extremamente variado (até demais... Não precisava tanto...) E bom atendimento. Muito caro. Mais de cem reais a média do prato pra dois."
31 de outubro de 2017,50,almoço com chefa,"Restaurante maravilho, com um excelente atendimento dos garçons Leandro e Moura. Além de ambiente agradável. Recomendo."
30 de outubro de 2017,40,Otimo,"Ambiente super agradável comida,maravilhosa atendimento excelente muito top mesmo gostei muito super indico."
30 de outubro de 2017,50,Almoço,"Germano, foi impecável!!! Parabéns!!! Comida excelente e ambiente agradabilíssimo música maravilhosa."
30 de outubro de 2017,50,"Comida excelente, ótimo atendimento!","Atendimento muito bom!! Germano muito educado e atencioso, comida boa e sobremesa deliciosa!!!! GOSTEI MUITO"
30 de outubro de 2017,50,Ótimo lugar.,"Ótimo Ambiente, sofisticado, boa música, lugar aconchegante. Garçom Germano muito atencioso, paciente!!"
30 de outubro de 2017,50,Jantar,"Comida excelente, local muito agradável, boa musica super bem atendida pelo garçon Renan. tudo perfeito."
30 de outubro de 2017,40,Ambiente agradável,"Estive,em outubro, no restaurante Coco Bambu e gostei do ambiente e do atendimento.A comida não é muito boa, pelo preço deveria ser melhor.Para quem tem filhos, há um ambiente para crianças com cuidadores."
29 de outubro de 2017,50,Jantar,"Ótimo atendimento do Guilherme e do Germano durante nosso jantar,em um ambiente muito agradável, com música ao vivo."
29 de outubro de 2017,40,Aniversário,"A comida é excelente, ambiente agradável, atendimento muito bom e músicas muito boas. Fomos atendidos pelos garçons Ari e Germano que foram muito receptivos."
29 de outubro de 2017,50,Atendimento,"Garçom Neuton e Murilo, atendimento excelente, a comida muitooooooo saborosa, ambiente climatizado e música de qualidade!"
29 de outubro de 2017,50,Atendimento,"Fomos atendido nesse ótimo restaurante por um excelente garçom. O Murilo, nos atendeu com bastante atenção."
29 de outubro de 2017,50,Atendimento,"Fomos atendidos pelo Garçom Murilo, com um excelente atendimento, comida muito boa e uma atenção maravilhosa"
28 de outubro de 2017,50,Jantar,"Restaurante execelente atendimento otimo, garçom muito simpatico Germano/barbosa newton. Comida perfeita, ambinete agradável. Otimo recomendo"
28 de outubro de 2017,50,Aniversário da amiga Lissanya Tavares,"Tudo ótimo, momento inesquecível em um lugar impecável Atendimento excelente feito pelos garçons Barbosa, Germano, Nelton e André"
28 de outubro de 2017,50,Amei tudo!,"Uma recepção maravilhosa, comida excelente, local ótimo para momentos familiares e com amigos. Amei vim ao local!"
28 de outubro de 2017,50,Jantar em família,"Comida excelente, sem contar o atendimento maravilhoso dos garçons Tiago e Hermivan que foram extramamente atensiosos e simpáticos!"
28 de outubro de 2017,50,Aniversário,"Atendimento muito bom! Ambiente e comida são exelentes parabens coco bambu. Sr. Germano, newton e Barbosa atendem muito bem."
28 de outubro de 2017,50,Jantar,Excelente atendimento e garçom bonito Germano. Barbosa Newton comida e sobremesa deliciosa.restaurante nota 100000
28 de outubro de 2017,50,Jantar,"Em jantar no restaurante CocoBambu Sul, excelente atendimento realizado pelos garçons Germano e Newton!"
28 de outubro de 2017,50,Uma noite maravilhosa,"Um restaurante que costumamos frenquentar mensalmente. Hoje, o nosso atendimento foi muito acima do esperado. Obrigado, José! Seu atendimento e profissionalismo deixou a nossa noite ainda melhor."
28 de outubro de 2017,50,Atendimento,"Fomos atendidos por Souza e Márcio. Ambos prestaram um atendimento rápido e extremamente atencioso. Equipe visivelmente qualificada, à altura de um restaurante com esse nome e tradição!"
28 de outubro de 2017,50,Sempre um prazer retornar ao restaurante,"Ambiente agradável, excelente serviço, garçons que nos atenderam, Souza e Márcio, foram atenciosos. Recomendamos."
28 de outubro de 2017,50,Atendimento,"Comida muito boa, ambiente agradável, atendimento excelente pelos garçons Márcio e Sousa!!! Recomendo!!!"
28 de outubro de 2017,50,Excelente.,"Ótimo atendimento, ótima comida e ótimo preço. O ambiente é confortável e bem pesando, com variações de ambientes. Um ótimo atendimento pelo garçom Alisson."
28 de outubro de 2017,50,Atendimento,"Garçons Germano, Alisson e Murilo, metre Mota. Excelente atendimento. Foi tudo muito bom. Voltaremos sempre."
28 de outubro de 2017,50,Casamento,"Excelente atendimento dos funcionários: Germano, Alisson e Murilo. Foi rápido e eficiente. Parabéns Recomendo."
28 de outubro de 2017,50,Reunião,"Bom atendimento dos colaboradores Germano, Alisson e Murilo. Local bacana e interessante! Vale a pena conhecer!"
28 de outubro de 2017,50,Casamento,"Comida deliciosa, atendimento atencioso especialmente dos garçons Murilo, Germano e Alisson. Muito bom!"
28 de outubro de 2017,50,Casamento Nathercia e Rafael Araújo,"Germano, Alisson e Murilo foram muito atenciosos e prestativos! Ótimo atendimento! A comida estava maravilhosa!"
28 de outubro de 2017,50,Casamento,"Fui atendido pelos garçons Alisson, Germano e Murilo O serviço foi prestado com excelência, cortesia e profissionalismo. Recomendo bastante o restaurante."
28 de outubro de 2017,50,Almoço em família,Fui mto bem atendida pelo garçom Henrique e a refeição estava excelente. A cerveja estava gelada e o local é mto agradável.
28 de outubro de 2017,50,Sr. José,"Local muito agradável, serviço de primeira categoria, atendimento excelente, cardápio e carta de vinhos de muito bom gosto."
27 de outubro de 2017,50,Excelente atendimento,Muito bom o prato sugerido “peixe crocante” e excelente atendimento do garçom Hermivan!!! Recomendo!!!!
27 de outubro de 2017,50,Comemoração de aniversário,"Excelente atendimento pelo garçom Fábio. Muitas opções no cardápio, atendendo a todos os gostos. Ambiente agradável e confortável."
27 de outubro de 2017,50,Jantar,"Ótimo atendimento do garcons Germano e perreira, são super rápidos e muito educados . Coco bambu sul nota 10"
27 de outubro de 2017,50,Excelente opção,Fui atendida pelo garçom Alison. Excelente atendimento. Comida excepcional e ambiente muito agradável. Recomendo!
26 de outubro de 2017,50,Ótimo atendimento,"Hoje jantamos no coco Bambu sul, estávamos com a família toda reunida, as crianças logo na entrada viram o parquinho e foram se divertir enquanto nós jantávamos sem se preocupar. Obrigado ao garçom Germano, muito atencioso. Excelente atendimento."
26 de outubro de 2017,50,Jantar de aniversário,Atendimento excelente garçons alisson e mutilou.restaurante agradável.musica boa e ainda ganhamos um bolo simbólico de aniversário
26 de outubro de 2017,50,Jantar,Fomos atendido pelo Germano que nos atendeu muito bem. A comida estava muito muito boa e a cerveja bem gelada.
26 de outubro de 2017,50,Melhor restaurante da cidade,"Comemos camarão do sertão, peixe a delícia, Sirigado ao forno, Lula a Dore que é maravilhosa... Tudo estava bom e o atendimento do garçon Fábio foi excelente..."
26 de outubro de 2017,50,família,"Noite entre familia incrivel, lugar tranquilo para confraternizar. Atendimento não deixou nada a desejar. Agradeço ao atendimento do Garçom Souza."
26 de outubro de 2017,50,Atendimento Célio/Souza,Atendimento excelente! O jantar estava delicioso. Ambiente muito agradável. Música ambiente de muito bom gosto. Cerveja no ponto.
26 de outubro de 2017,50,Aniversário de casamento,Viemos comemorar nosso aniversário de casamento Fomos super bem recebidos pelo garçom Alisson Onde tivemos um excelente atendimento e Ainda tivemos uma supresa no Final com bolo simbólico. Onde o mesmo foi oferecido pelo Gerente Cicero Indico para todos o coco bambu sul.
26 de outubro de 2017,50,Atendimento germano/solsa,"Tudo maravilhoso. Comida, atendimento, bebidas. Tudo de melhor qualidade. Ambiente muito bom. Limpeza ótima."
26 de outubro de 2017,50,Jantar com o marido.,"Excelente atendimento do garçom Alisson, ambiente e músicas agradáveis, cardápio variado e delicioso."
26 de outubro de 2017,50,Atendimento,"Garçom Murilo foi prestativo, atencioso e cortês. Atendeu satisfatoriamente às nossas demandas, inclusive com sugestões que nos agradaram bastante."
26 de outubro de 2017,50,Jantar,"Ótimo restaurante com boa opções de carne,peixe e camarão. Agradecendo o atendimento do Danilo e do Germano."
26 de outubro de 2017,50,Aniversário no Coco Bambu,"Fiz a festa de aniversário da minha filha no Coco Bambu Sul, tudo muito gostoso, espaço muito bacana e o Garçom Fábio nos atendeu muito bem ele e sua equipe estão de parabéns. Recomendo muito fazer os eventos lá."
