19 de março de 2022,50,William garçom,Show William valeu William é um cara bom nos ajudou nós pedidos e nos drinks as comidas do resto são ótimas William é desenrolado
17 de março de 2022,50,Jantar com familia e amigos,"O taxista nos indicou esse restaurante, e ficamos na dúvida. Mas foi tudo muito bom. Chopp Gelado, musica boa, Bacalhau lagareiro espetacular e preço justo pelas refeiçoes.!!"
16 de março de 2022,50,40tao da diferentona!,"Fomos atendidos, pelo William, com muita excelência! serviço maravilhoso! Parabéns pelo atendimento!"
16 de fevereiro de 2022,50,Jantar de aniversário.,"Ambiente agradável, organizado, atendimento eficiente, o garçom William foi muito atencioso e simpático. Música ambiente estava um pouco alta, mas o músico toca e canta muito bem."
16 de fevereiro de 2022,50,Jantar em família,"Comida excelente e bem servida, com um ótimo atendimento e um bom local para se confraternizar com a família"
15 de fevereiro de 2022,50,Bom atendimento,Atendimento excepcional do colaborador William no coco bambu sul. Muito atencioso e solicito. Nota 10!
15 de fevereiro de 2022,50,Coco Bambu.,Excelente atendimento e ótima percepção das necessidades da mesa… Ambiente salutar e espaço Kids com espetacular proporção…
14 de fevereiro de 2022,50,Aniversário,"Atendimento muito bom do Wilian, atencioso, gostamos bastante! Voltaremos mais vezes! Parquinho maravilhoso para as crianças!"
14 de fevereiro de 2022,50,Top,Top o andre adorou ele vai voltar o bruno tambem o luiz tambem a barbara tambem a marina tambem e eu achei massa
13 de fevereiro de 2022,50,Garçom William,"Não teria voltado ao local não fosse o atendimento EXEMPLAR desse carinha. Tomara que botem ele pra fora, pq meus headhunters JAMAIS dispensarão o talento e o carisma desse cara. Espero ele pra ser gerente de salão no meu negócio!!"
13 de fevereiro de 2022,50,Almoço em família,"Excelente atendimento muito atencioso e muito satisfeito pelo profissionalismo do Willian, é muito feliz pela escolha do ambiente."
12 de fevereiro de 2022,50,Jantar romântico,Atendimento espetacular de Willian. Super atenciosos e bem conhecedor do cardápio . Sugeriu CAMARÃO ao algo e óleo. Agradeço William seu atendimento .
11 de fevereiro de 2022,50,Jantar,Atendida pelo Sr Maicon Excelente atendimento Muito grata Indico Música boa Bom ambiente Comida gostosa
11 de fevereiro de 2022,50,Jantar em família,"Fomos ao coco bambu sul para um jantar em família, sendo super bem atendidos pelo Maicon, que foi super prestativo e não deixou faltar nada em nossa mesa! Recomendo."
11 de fevereiro de 2022,50,Happy Hour,Bom atendimento garçon Maicon muito atencioso e educado. Comida e bebidas satisfatórias e ambiente agradável.
9 de fevereiro de 2022,50,Coco bambu Sul,"Garçom muito gente boa! Profissional excelente. Nota 1000. Educado, atencioso e cuidadoso. Willian toda vez que vinha na mesa deixava tudo limpo, sempre muito cordial."
9 de fevereiro de 2022,50,Happy hour,"Willian é um excelente garçom, quebrou o gelo de um começo estranho, pouca gente e ele veio e amenizou e transformou a experiência"
8 de fevereiro de 2022,50,Excelente atendimento.,Excelente atendimento pelo garçom Willian do coco bambu sul Super prestativo e atencioso. Com certeza voltarei
8 de fevereiro de 2022,50,Jantar em família,"Quero ,agradecer o atendimento maravilhoso do William,melhor atendimento da vida.será meu atendente preferido"
8 de fevereiro de 2022,50,Avaliação atendimento Coco Bambu Sul,Atendimento excelente do garçom William. Nota 10. Fomos bem atendidos desde a entrada. Família recomenda.
8 de fevereiro de 2022,50,Almoço em Família,"Parabéns Jan. Atendimento Perfeito no Coco Bambu Sul. Gentil, Prestativo e Muito Atencioso. Obrigado!"
7 de fevereiro de 2022,50,Recomendo demais!,"Atendimento do Willian impecável tornou nossa experiência muito melhor. Chopp gelado no happy hour, comida gostosa e música boa."
7 de fevereiro de 2022,50,Excelente atendimento,"Noite agradável, comida boa, e ótimo atendimento do William. Boa comida e bebida, estacionamento seguro."
7 de fevereiro de 2022,50,Garçom,"Garçom William, prestativo, atencioso, excelente atendimento, recomendo o Peixe crocante. Os preços do happy hour são ótimos"
6 de fevereiro de 2022,50,Excelente atendimento,O William foi um excelente anfitrião pra essa visita. Fomos atendidos muito bem e rapidamente! Excelente!
6 de fevereiro de 2022,50,Garçom William,Excelente atendimento. Super atencioso e prestativo. Gostamos muito. Além de super simpático e com sorriso no rosto
4 de fevereiro de 2022,50,Atendimento de qualidade,"Atendimento excelente do William, muito prestativo e atencioso!! Qualidade top da comida!! Voltaremos mais vezes."
2 de fevereiro de 2022,50,Educação,"Ambiente excelente, com música ao vivo, sabor excelente. Teve uma certa demora em entregar os pedidos, mas acredito que foi questão da cozinha que estava cheia. Agradeço ao garçom Willian pelo atendimento."
2 de fevereiro de 2022,50,Otimo para aniversário,"Serviço muito bom, em especial o garçom William que nos atendeu de forma muito prestativa e atenciosa!"
2 de fevereiro de 2022,50,Atendimento de qualidade,"Achei a comida maravilhosa como sempre. Fomos atendidos pelo William, que nos proporcionou um ótimo atendimento, super recomendo!"
2 de fevereiro de 2022,50,Jantar Romântico,"Coco Bambu Sul como sempre muito bom, comida maravilhosa. Fomos atendidos pelo William, atendimento excelente, muito educado e desenrolado. Super recomendo."
2 de fevereiro de 2022,50,Melhor jantar de Fortaleza!,"Comida muito boa dentro da cidade e peçam pra ser atendidos pelo Maicon, atendimento muito acima da média, difícil de encontrar em outros restaurantes."
1 de fevereiro de 2022,50,Jantar a 2,"Comida maravilhosa, bem temperada, quantidade boa. Atendimento do garçom William excelente, muito atencioso, nos proporcionou uma experiência bastante agradável!"
1 de fevereiro de 2022,50,Atendimento Excelente,"Atendimento maravilhoso feito pelo garçom William, atencioso, gentil e dedicado. Filé alfredo delicioso, carne no ponto certo, e massa com molho maravilhoso!"
1 de fevereiro de 2022,50,Jantar romântico,"garçom William super gentil, muito educado, gostei bastante do atendimento dele, voltarei mais vezes."
30 de janeiro de 2022,40,Jantar em família,William é um excelente garçom. Muito prestativo e educado. Não é invasivo e super atencioso... gostamos muito.
30 de janeiro de 2022,50,Jantar em família,Atendimento excelente! Muito atencioso e educado! Deixando tudo limpo e organizado! Excelente experiência
25 de janeiro de 2022,50,Aniversário de Fernanda,"Camarão coco Brasil delicioso, porção excelente para 8 pessoas.... atendimento do garçom Ronaldo Martins foi nota 10. Música agradável assim como o ambiente.!! Super recomendo."
25 de janeiro de 2022,50,Coco Bambu,"Ótimo atendimento! Simpatia dos atendentes e comida deliciosa, muito bem servida, voltaremos sempre!"
25 de janeiro de 2022,50,Almoço em familia,"Atendimento muito incrível!! Ambiente muito agradável, temperatura e som também. Recomendo muito e voltarei"
25 de janeiro de 2022,50,"Não conhecia mas amei, nossa que perfeito","William nós atendeu muito bem. Nós sentimentos em casa, e eu e minhas duas irmãs. Nunca fomos tratados com tanto amor e carinho. Muito obrigado!"
25 de janeiro de 2022,50,Aniversario de prima,"Excelente atendimento, foi o imperador que nos atendeu. Foi aniversario da minha prima e foi tudo muito bem feito"
25 de janeiro de 2022,50,Incrível,"Atendimento ótimo do Wilian, ambiente bem agradável. Vou voltar mais vezes!!!!!! Com uma ótima localização!!!!!!!!"
24 de janeiro de 2022,50,Nota 10,"A comida maravilhosa e o atendimento do Jan, impecável. Coco Bambu sempre perfeito. Nota 10. Sempre perfeito."
21 de janeiro de 2022,50,Jantar em família,"Bon atendimento. Garçon Willian prestativo e atencioso, inclusive fazendo o registro fotográfico. Boa música. Rapidez no serviço."
21 de janeiro de 2022,50,Aniversário da mãe,Muito atencioso e animado! Foi muito bom vir comemorar o aniversário da minha mãe aqui. Voltarei outras vezes!
21 de janeiro de 2022,50,Bom atendimento,"Ótimo atendimento, simpático, educado, trouxe a comida com cuidado e rapidez e nos atendeu de uma forma bem rápida. Super indico."
21 de janeiro de 2022,50,Maravilhoso,Fomos muito bem atendidos pelo garçom William. A comida e o ambiente são excelentes. Ótimo lugar para ir com a família e amigos.
19 de janeiro de 2022,50,Jantar em família,"Ótimo atendimento, do garçom Maicon. Ótima comida e excelente ambiente, ótima recepção e atenção dos funcionários"
19 de janeiro de 2022,50,Aniversário,"Atendimento excelente, Maicon foi muito atencioso, rápido, prestativo, voltaria aqui mil vezes para ser atendida por ele. Excelente colaborador!"
19 de janeiro de 2022,50,Coco bambu,"Comida estava ótima e o atendimento do garçom Maicom foi ótimo, a música estava também muito legal, tudo ótimo"
19 de janeiro de 2022,50,Excelente atendimento,Excelente atendimento no Coco Bambu Sul. O atendimento do garçom Jacó foi excepcional. Atencioso e prestativo. Um dos meus restaurantes favoritos.
18 de janeiro de 2022,50,Atendimento ótimo do Micon,"Atendimento excelente, comida muito boa, música muito boa. Tudo de boa qualidade.. Ótimo ambiente para comemorar datas comemorativas."
12 de janeiro de 2022,40,Restaurante agradabilíssimo,"Restaurante da franquia coco bambu localizado na zona sul da cidade. O padrão é o mesmo, com ótima comida e atendimento rápido e cortês. Tem parquinho infantil, mas o preço pode melhorar um pouco."
9 de janeiro de 2022,50,Coco Bambu Sul,"Música MPB ótima!!!!! Ambiente muito agradável!!!! Comida maravilhosa e garçom Willam alto nível, excelente!!!!"
9 de janeiro de 2022,50,Willian,"Atendimento excelente! Fomos bem recebidos e muito bem tratados!! Música muito agradável, gostosinha de se escutar!"
8 de janeiro de 2022,50,Amigos,Atendimento muito top desse garçom gente boa. Aqui no coco bambu somente com ele. Vale a pena vir aqui.
7 de janeiro de 2022,50,Garçom William,"Ótima comida, ambiente e atendimento. Garçom muito atencioso e gentil. Voltarei com certeza. Satisfeita com a experiência."
7 de janeiro de 2022,50,João neto,"Boa noite venho informar que o william é um excelente profissional, um cara que nos atendeu super bem, nunca tinha passado por um atendimento tão bom!! Super recomendo o cara é super gente boa é levanta o nome do coco bambu 👏🏾👏🏾"
7 de janeiro de 2022,50,Jantar em familia,"Restaurante excepcional, espaço muito agradável, música boa e garçom muito atencioso, recomendo muito, nota 100000"
4 de janeiro de 2022,50,Romântico,"Um ótimo atendimento, com atenção em todos os detalhes, que você continue sempre assim Wiliam abraço"
3 de janeiro de 2022,40,Foi muito bom,Serviço muito bom gostamos da comida do atendimento bebida gelada Garçom atencioso restaurante digno de indicações para amigos
2 de janeiro de 2022,50,Excelente,Muito bom! Sem reclamações. Todos os funcionários extremamente bem treinados e educados. Sem dúvidas irei voltar
1 de janeiro de 2022,50,Jantar em família,Atendimento excelente! Muito educado e prestativo! Toda família se sentiu confortável! Parabéns!!! Top de linha!
1 de janeiro de 2022,50,Excelente atendimento,"Atendimento do William excelente , muito solícito e educado, e comida muito boa, filé ao molho madeira."
1 de janeiro de 2022,50,Réveillon 2021/2022 . Garçom William atendeu perfeitamente. Zero defeitos. O melhor!!,Réveillon 2022. Fomos atendidos pelo garçom William. O melhor de todos. Zero defeitos!!. Nao tenho o que reclamar. Perfeito
28 de dezembro de 2021,50,Almoço negócios,"Excelente atendimento e comida de qualidade, o William atendeu muito bem, explicou bem os pratos. Ambiente agradável."
28 de dezembro de 2021,50,Almoço de confraternização,Excelente atendimento do garçom. Comida muito boa. Preço acima do mercado. Boa higienização. Estacionamento ótimo
24 de dezembro de 2021,50,Jantar em família Natal,"Excelente!!!! William é um ótimo profissional!!!! Profissional top super educado, ambiente excelente"
24 de dezembro de 2021,50,Natal,"Excelente atendimento profissional top muito bom, William , Coco Bambu está de parabéns , super educado"
22 de dezembro de 2021,50,Jantar,Ótimo atendimento. Garçom William muito dedicado e atencioso. Comida e música boa. Ótimo local para ir com criança
20 de dezembro de 2021,50,Jantar romântico acompanhado de uma cerveja especial.,"Atendimento dos garçons de excelência, com ambiente super agradável, prato servido com zelo e de sabor memorável."
20 de dezembro de 2021,50,Avaliação,"Positiva, muito bom. Atendimento maravilhoso, garçom William, muito atencioso. Comida maravilhosa! Sempre bom"
20 de dezembro de 2021,50,Atendimento maravilhoso prestado pelo William,"Em agradecimento ao serviço prestado pelo Garçom William, super atencioso e cuidadoso! Super recomendo o local e o menu."
18 de dezembro de 2021,50,Avalaicao,"O atendimento do garçom foi excelente, mas a comida demorou um pouco a chegar pela quantidade de pessoas."
18 de dezembro de 2021,50,Excelente atendimento recebido pelo William,"Excelente atendimento, muito educado e atencioso. Nos fez recomendações e atendeu com muito bom humor. Recomendo!"
18 de dezembro de 2021,50,Avaliação de atendimento- Garçom William,"Gostaria de agradecer a atenção do senhor William, ele foi muito educado prestativo e proativo, total diferença na noite. Parabéns William, parabéns ao coco bambu sul!"
16 de dezembro de 2021,50,Confraternização entte amigos!,"Gostaria de parabenizar o garçom William pela atenção, cordialidade, e atenção com todos da mesa!feliz natal"
16 de dezembro de 2021,50,Ambiente muito bonito e comida gostosa,"Noite com os amigos descontraída e colocando os papos em dia, regada a bons vinhos e comida boa. Música ao vivo com excelente repertório"
16 de dezembro de 2021,50,Ótimo,Melhor restaurante de frutos do mar. Atendimento rápido e eficiente pelo garçom William. Reunião familiar para agradecer 2021
16 de dezembro de 2021,50,Jantar em familia,"Garçom William atendeu muito bem, mesmo com a casa cheia. Parabéns. No entanto, houve qtrazo na cozinha"
16 de dezembro de 2021,50,Melhor garçom,"Procurem o William do Coco bambu sul. Atencioso e simpatico, deu dicas de bons vinhos pra gente! Foi otimo."
15 de dezembro de 2021,50,Ótimo atendimento.,"Fomos atendidos por William, que prestou um excelente atendimento. Comida de muita qualidade e ambiente muito agradável."
14 de dezembro de 2021,50,Avaliação,"Muito bom o atendimento, atenção em todo o tempo de serviço e indicação de pratos.Satisfatório também a apresentação pessoal e gentileza"
14 de dezembro de 2021,50,avaliação,"Muito bom o atendimento, atenção em todo o tempo de serviço, indicação de pratos, etc . Realmente muito bom"
14 de dezembro de 2021,50,Atendimento,"Muito atencioso e prestativo explica bem os pratos, melhor atendimento do Coco Bambu. Tá de parabéns."
13 de dezembro de 2021,50,Garçom Willian,"Muito simpático, desde a entrada já foi nos receber com a maior alegria, rápido tanto quando chamamos quanto pra trazer a comida e educado demais! Adorei"
13 de dezembro de 2021,50,Almoço de negócios,"Coco bamboo tem ótima comida, bom atendimento e ambiente aconchegante. Tive uma ótima experiência… Super indico!"
13 de dezembro de 2021,50,Avaliação,"Um ótimo atendimento é muito atencioso, quando precisamos de uma caneta ele fui super ágil e muito gentil!"
13 de dezembro de 2021,50,Garcom william,"Muito boa o garçom wiliam, gostamos bastante, atencioso demais e que mostra gostar do que faz, comida muoto boa"
13 de dezembro de 2021,50,Avaliação William,William nos atendeu perfeitamente bem durante a reunião entre amigos que tivemos aqui no Coco Bambu Sul.
12 de dezembro de 2021,50,Muito bem atendido pelo William.,"Muito bem atendido pelo William. Atendimento nota 10. Comida boa, prestativo, cercado de amigos. Indico demais para confraternização nesse final de ano."
12 de dezembro de 2021,50,Muito bom,Muito bom o atendimento a comida veio rápida e quente deu para aproveitar muito os funcionários também são muito carimasticos
12 de dezembro de 2021,50,Coco Bambu sul,"Otimo avaliação do restaurante e do garçom willian supersimpatico e muito prestativo, sempre atento a necessidade da mesa"
12 de dezembro de 2021,50,Ótimo avaliação,"Ótimo atendimento, ótima comida, gostamos muito do ambiente e da recepção! Foi muito bom, nós adoramos!!!!!!!!!!!!!"
10 de dezembro de 2021,50,Confraternização,"Ótimo atendimento, agilidade no atendimento, educação por parte do garçom. Ótimo ambiente. Comido excelente"
10 de dezembro de 2021,50,Lugar acolhedor,"Adoro o Coco Bambu. Cardápio e ambiente muito bom e diverso. O garçom que nos atendeu, William, muito atencioso, simpático e prestativo."
9 de dezembro de 2021,50,"EXCELENTE ATENDIMENTO DO SR WILLIAM.. sempre muito bom atendimento, especialmente a pizza que é uma delicia..","Excelente atendimento., Garçom Willian mostra-se sempre preocupado em prestar melhor atendimento, Cortez e educado demais... super recomendo"
7 de dezembro de 2021,50,Garçom Henrique,"Um ótimo Garçom, atendimento top, atencioso, sempre disponível próximo a mesa, comida deliciosa e rápida, parabéns Henrique e obrigada por proporcionar uma noite agradável nesse restaurante...voltaremos mais vezes."
6 de dezembro de 2021,50,Avaliação sobre o espaço e geral,"Primeira vez indo neste unidade e há quero ir de novo. Ótimos funcionários; Ótima recepção; Sem falar da comida servida, irei indicar para vários amigos!!"
5 de dezembro de 2021,50,Atendimento,"Ótima atendimento, a comida estava maravilhosa, o local agradável e a música ótima. Um local que voltaria muitas vezes"
4 de dezembro de 2021,50,Jantar noivado,"Garçom maravilhoso, bem atencioso, bom astral. Amei a receptividade. Voltarei mais vezes concertada."
4 de dezembro de 2021,50,Almoço,"Coco Bambu Sul, comida excelente. Ambiente super confortável e agradável. Fomos atendidos pelo garçom William! Super atencioso..."
1 de dezembro de 2021,50,Avaliação restaurante,Restaurante maravilhoso e o atendimento do garçom William nota 10. A comida também estava impecável. Vale a pena conferir!
1 de dezembro de 2021,50,Agradabilíssimo,"Ótimo atendimento, local agradável, valores medianos, muito bem higienizado, cumprindo as normas sanitárias! Recomendo a visita!"
1 de dezembro de 2021,50,Almoço,Ótimo restaurante e o garçom William super prestativo e atencioso. Salada uma delícia e atendimento rápido.
30 de novembro de 2021,50,William mestre!,"Esse William é craque! Educado, servidor.. fez minha noite perfeita! Quero repetir por conta de você meu amigo! Enviado de Deus!"
30 de novembro de 2021,40,Atendimento diferenciado,"O garcon Sr Willian muito atencioso e prestativo, nos atendeu com agilidade e cortesia. Ambiente agradável"
16 de novembro de 2021,50,Almoço com o marido,"Atendimento maravilhoso ! Nota 10! Atendimento do garçom rápido e eficiente ! Lugar agradável, mesa sem barulho"
13 de novembro de 2021,50,Jantar,Comida muito boa e atendimento de Ronaldo Martins excelente. Parquinho organizado e limpo. Banheiro lá impecáveis com relação a limpeza
1 de novembro de 2021,50,Jantar com esposa,Jantar maravilhoso com camarão búzios delicioso regado a caipirinha de seriguela e atendimento prestativo e sem retoques do Ronaldo Martins!
29 de outubro de 2021,50,Jantar coco bambu,"Atendimento excelente, música ao vivo, ambiente climatizado,comida de qualidade e porções bem servidas . $$$ . Ótimo custo benefício. Segue todos protocolos de segurança."
29 de outubro de 2021,50,Aniversário no coco bambu,"Ótimo atendimento , rapidez na comida , e cardápio maravilhoso ambiente familiar e com clima bastante agradável ! De parabéns o cumim gabriel e Eduardo"
26 de outubro de 2021,50,Aniversário Liana,"Atendimento incrível do nosso garçom Ronaldo, super agradável e atencioso. Comida deliciosa!! Voltaremos muitas outras vezes."
26 de outubro de 2021,50,Almoço com as amigas,"Ótima comida , ambiente agradável e ótimo atendimento do garçom Ronaldo Martins . Recomendo bastante!!!!"
22 de outubro de 2021,50,Excelente,Comida muito boa e espaço bem Familiar. Atendimento excelente! Super recomendo. Preços um pouco salgados... Mas o custo benefício Compesa. Um alô para o garçom Ronaldo! Muito bom o atendimento.
22 de outubro de 2021,50,Almoço executivo,"Ronaldo Martins foi super atencioso, prestativo e ágil no atendimento. Sempre com sorriso no rosto e educação."
22 de outubro de 2021,50,Almoço,"Comida sensacional Atendimento excepcional. Ronaldo Maritns é um caba Strogonoffico. Top demais. Só falta a gente ser carregado nós braços, mas ele parece meu mahuim. Gente boa de maisssssss"
20 de outubro de 2021,50,Excelente,"Fui com a família, ambiente é ótimo, comida boa, e atendimento ímpar. Tudo perfeito, vale a pena conhecer."
23 de setembro de 2021,50,Aniversário,"Meu restaurante preferido❤️ Ronaldo sempre nos atende muito bem, atencioso e com simpatia. A comida sou suspeita a falar como falei é o meu restaurante preferido tudo lá pra mim é perfeito."
19 de setembro de 2021,50,Jantar em família,"10, excelente. Garçom muito atencioso! (William) Comida muito boa, de ótima qualidade e muitíssimo saborosa."
6 de setembro de 2021,50,Almoço,"Gostaria de agradecer o atendimento ao garçom Ronaldo Martins, atendimento de excelência. Grata pela indicação do prato principal e entrada. Satisfeita."
5 de setembro de 2021,50,Almoço,"A entrada estava deliciosa. O prato Búzios é um dos melhores! O garçom Ronaldo Martins foi bastante cordial, simpático e atencioso. Adoramos tudo!"
30 de agosto de 2021,50,Ótimo Lugar,"Perfeito. Ótimo lugar , ótima comida, restaurante nota 10. Staff muito bom e seguro com os protocolos sanitários."
18 de agosto de 2021,50,Almoço de Dia dos Pais,"Ótimo para comemorações. O ambiente é muito muito bonito (uma combinação de rústico com sofisticado) e o serviço é muito bom. A comida é saborosa e bem servida. O custo é não é baixo, mas totalmente razoável com a qualidade oferecida."
22 de julho de 2021,50,Garçom,"Ótimo atendimento, prestativo, atencioso, gostei muito do atendimento o moço é muito simpático e muito legal"
16 de julho de 2021,50,Perfeita,"Wiliam atendeu super bem, Coco Bambu é um restaurante que não decepciona em nenhum prato, sempre o sabor é incrível, recomendo demais"
16 de julho de 2021,50,Muito bom!,Excelente atendimento e comida maravilhosa. Ambiente super agradável e seguindo as recomendações. Adorei!
10 de julho de 2021,50,Pizza maravilhosa,"Viemos conhecer o local e achamos maravilhoso. A pizza é incrível (nunca havíamos comido uma pizza tão deliciosa), local agradável e um atendimento fabuloso. Gostaria de elogiar o senhor Ronaldo Martins que nos atendeu de forma atenciosa, educada, gentil e super profissional."
5 de julho de 2021,50,Garçom Willamy Coco bambu Fortaleza.,"Restaurante Coco bambu de Fortaleza impecável no atendimento. Os garçons excelentes, sobretudo o Garçom Willamy. Impecável seu atendimento. Ficamos muito contentes. Parabéns, Willamy."
30 de junho de 2021,50,Coco bambu,"Atendimento William nota 10, coco bambu sul, ambiente excelente e de alto padrão, parabéns! Super indico"
27 de junho de 2021,50,Almoço,"Pedimos os pratos Carne do Sol do Maranhão e Sirigado à Belle Maniuere. Excelentes! 200% na qualidade. O atendimento garçom RONALDO Martins excepcionalmente atencioso, bem humorado e paciente."
22 de junho de 2021,50,Jantar,Comida excelente Ambiente aconchegante Atendimento do garçom Ronaldo Martins. Com excelente atenção. Educação. E conhecimento dos produtos oferecidos pelo restaurante
20 de junho de 2021,50,Jantar em família,"Atendimento excepcional, garçom William nos recebeu muito bem, muito atencioso. Comemos muito bem, comida maravilhosa, deliciosa! 5 estrelas! 🌟🌟🌟🌟🌟"
20 de junho de 2021,50,Jantar em família,"Antendimento de primeira qualidade, ambiente acolhedor, agradável e com música incrível, comida excelente."
19 de junho de 2021,50,Jantar c,"Ambiente familiar, excelente atendimento pelo garçom Ronaldo Martins, bastante atencioso e prestativo. Recomendo"
13 de junho de 2021,50,Pastel de Camarão e Suco Morango com Cupuaçu,Pastel de Camarão e Suco Morango com Cupuaçu muito bons. O prato camarão búzios muito bom e bem servido para 2 pessoas.
13 de junho de 2021,50,Jantar de namorados,O menor restaurante de fortaleza em Quesito comida e atendimento ! Coco bamboo trata todo mundo bem e a comida é sensacional!
22 de maio de 2021,50,Jantar,"Atendimento excelente do Garçom Ronaldo Martins e a comida impecável! Ambiente agradável, recomendo!"
19 de maio de 2021,50,Almoço,"Gostaria de agradecer ao garçom Eduardo que nos recepcionou e nos atendeu com perfeita maestria, música excelente e comida de primeira."
20 de abril de 2021,50,Almoço,"Atendimento incrível pelo garçom Ronaldo Martins, almoço impecável como sempre, frequento o restaurante a muitos anos e indico de olhos fechados, ambiente sempre agradável."
20 de março de 2021,50,muito bom,"garçom FRANCILINO é muito atencioso e educado. comida boa e saborosa, ambiente familiar, cardapio exelente e atendimento otimo"
