1 de outubro de 2019,50,Niver Brenda e Edilene,Atendimento espetacular do garçom Ronaldo Martins. E os pratos camarão internacional e carne do sol a sertaneja deliciosos. Obrigada! Nota 10.
30 de setembro de 2019,50,Jantar,"Atendimento top Ronaldo Martins , nota 10 perfeito sugestão maravilhosa do prato de dirigido adorei tudo"
30 de setembro de 2019,50,Jantar,"Espaço muito bom! Comida ótima! Atendimento excelente! O garçom Ronaldo Martins, além de um ótimo atendimento ainda é muito simpático! Ótima experiência!"
30 de setembro de 2019,50,Jantar,"Fui jantar hoje no restaurante e fui atendida pelo garçom Ronaldo Martins, atendimento impecável, prestativo, excelência em tudo. A sobremesa divina. Vale a pena a visita."
30 de setembro de 2019,50,Garçom Marcilio,"Garçom Marcilio Antedimento muito eficiente , nota dez , pratos muitos saborosos e bem servidos , gratidão ao marcilio pelo ótimo Antedimento."
30 de setembro de 2019,50,Garçom Marcilio,"Excelente antedimento do Marcilio,musicas muito agradável ambiente sesancional,recomendo sim,voltarei."
30 de setembro de 2019,50,almoço,"camarão de olinda muito bom, atendimento excelente do ronaldo martins, música boa, e pretendemos voltar varias outras vezes"
30 de setembro de 2019,50,almoço,comida excelente e atendimento impecável do ronaldo martins! voltarei outras vezes sem duvidas musica excelente
30 de setembro de 2019,50,Almoço,A isca de peixe é ótimo e fui atendida muito bem pelo garçom Ronaldo Martins ambiente muito agradável
30 de setembro de 2019,50,Atendimento Excelente,"Ronaldo Martins, nos atendeu muito bem. Pratos vieram rápido e conforme falado. Ronaldo foi muito atencioso nos indicando pratos, bebidas e sobremesa."
30 de setembro de 2019,50,Atendimento excelente,Os pratos estavam deliciosos e muito bem servidos. O garçom Ronaldo Martins foi excepcional! Ficamos super felizes!
30 de setembro de 2019,50,Almoço,"Atendimento maravilhoso, no com garçom show de bola, Rinaldo Martins, #PromoverGerente.recomendarei aos amigos"
29 de setembro de 2019,50,Jantar,Muito bom. Atendimento excelente 'muito atencioso 'conhecedor do que faz. É bom ser servido por um profissional desta qualidade.
29 de setembro de 2019,50,Jantar,"Prato (camarão praia de olinda): como sempre, muito saboroso. Garçom Ronaldo Martins: muito educado, atencioso e ágil."
28 de setembro de 2019,50,Jantar romântico,Ótimo atendimento por Ronaldo Martins e pelo maître marciel Prato maravilhoso ! Música boa ótimo ambiente.
28 de setembro de 2019,50,Jantar romântico,"Atendimento perfeito Garçom Ronaldo Martins s do maitre Marciel!, Ótima indicação de prato, picanha excelente."
28 de setembro de 2019,50,Aniversário Patrícia,"Atendimento do Ronaldo Martins foi excelente! Muito atencioso e eficiente. Maitre Marciel nos surpreende com os pratos Rede de Pescador, camarão Internacional e Pirarucu Meineire com sabores maravilhosos."
28 de setembro de 2019,50,Jantar,"Uma delícia comida, de primeira. MT apreciável. Atendimento do Ronaldo Martins ótimo, MT bem atendida, juntamente com o Sr. Marciel"
28 de setembro de 2019,50,Jantar,Otima . Atendimento Ronaldo Martins Prato carne do sol sertaneja. Juntamente com Maitê Marcio voltaremos
28 de setembro de 2019,50,Atendimento Ronaldo,"Atendimento excelente, comida muito boa,ambiente agradável, garçom Ronaldo Martins e Metrio Maciel muito atencioso sempre dispostos a nos servir com precisão super recomendo"
28 de setembro de 2019,50,Jantar em família,"Cardápio excelente, ambiente aconchegante, boa música!! Atendimento do garçom Ronaldo Martins e Maitre Maciel."
28 de setembro de 2019,50,Atendimento Ronaldo,"Comida deliciosa com atendimento de primeira com o garçom Ronaldo Martins e metri Maciel, recomendo com certeza"
28 de setembro de 2019,50,Melhor escolha para quem tem crianças,"Um excelente ambiente, com cardápio variado e delicioso. Uma boa pedida para quem tem filhos pequenos, pois conta com um parque diversificado. Local para se divertir com toda a família."
28 de setembro de 2019,30,Para turista,Ambiente muito bom e com bastante opção no cardápio! Mas se quiser comer frutos do mar aqui em Fortaleza existem varias opções melhores e com preços similares! Muito frequentado por turistas devido propaganda!!!
28 de setembro de 2019,50,Excelente atendimento,"Fomos super bem atendidos pelo Sr Adriano, super cortez, agradável e prestativo. Prato muito saboroso e local muitíssimo agradável."
28 de setembro de 2019,50,Almoço,"Excelente prato e atendimento. Em especial a Ronaldo Martins, muito atencioso e gentil. Com certeza voltaremos!"
27 de setembro de 2019,50,Niver patricia,Fomos muito bem atendidos pelo Ronaldo Martins comida maravilhosa e ambiente agradavel agradecer ao maître marciel
27 de setembro de 2019,50,Maciel e Adriano Moura,"Recomendo Coco Bambu, prato Camarão em crosta, estava delicioso, camarão no ponto certo e risoto de limão siciliano bem cremoso, delícia."
27 de setembro de 2019,50,Jantar a dois,Atendimento muito bom dos funcionários Adriano Moura e Marciel. Tempo bom de espera. Recomendo demais
27 de setembro de 2019,50,Jantar,Pereira foi MARAVILHOSO! Atendimento impecável! Comida deliciosa. Tudo perfeiro como sempre. Obrigada!
27 de setembro de 2019,50,Jantar,"Vim a esta casa, onde fui muito bem atendido pelo garçom, Ronaldo e Maitre Marciel. As pessoas que vieram comigo amaram, pois não tem como não gostar dos sabores e atendimento."
27 de setembro de 2019,50,Jantar,"Atendimento do garçom Ronaldo Martins e do metre Marciel foi maravilhoso, super atenciosos, educados, prestativos e comida maravilhosa como sempre, filé a parmegiana perfeito, pastel de camarão ótimo!"
27 de setembro de 2019,50,Jantar,"Garçom Ronaldo Martins nos atendeu muito bem, atendimento excelente Prato de peixe a delícia serve bem 3 pessoas, bem saboroso"
27 de setembro de 2019,50,Atendimento top,"Fomos ao coco bambu sul, atendimento top do garçom Ronaldo e maitre Maciel simpatia com ótima qualidade."
27 de setembro de 2019,50,Almoço a dois,Garçom Ricardo e Maître Maciel foram bem atenciosos. São muitas opções no cardápio mas eles souberam indicar as melhores relações custo-benefício.
27 de setembro de 2019,50,Atendimento topppp do Ronaldo e Maciel,Excelente em todos sentidos atendimento bom Garçom excelente Comida gostosa Tudo bommmm local limpo e agradavel
27 de setembro de 2019,50,Almoço,"Prato sensacional, e o atendimento nem se fala! Garçom Ronaldo Martins e Maciel!!! Recomendo voltarei mais vezes"
27 de setembro de 2019,50,Almoco,"a comida está excelente, o garçom de nome Adriano Moura e maitre Maciel nos atenderam mito bem, com educação e presteza!"
27 de setembro de 2019,50,Ronaldo e Maître Maciel,"Atendimento excelente, ambiente agradável, comida boa, preço ótimo, tem estacionamento disponível..."
27 de setembro de 2019,50,Almoço com amigos,Fomos atendidos pelo Garçom Anderson a Maitre Marcial e Celio. P almoço estava uma delícia. Recomendo o prato carne de sol do Maranhão.
26 de setembro de 2019,50,Confraternização,"Parabenizar o garçon Adriano Moura pelo atendimento e o maitre Maciel por todo dia simpatia e atenção, comida muito deliciosa indico a todos!!!!"
26 de setembro de 2019,50,Comemoração,"Adorei atendimento e o ambiente , parabéns pela atenção dispensada ao cliente , Adriano Moura e maitre Maciel"
26 de setembro de 2019,50,Jantar de aniversário,"Comida deliciosa como sempre, e vale a pena reforçar o excelente atendimento do Baiano! Super atencioso e solicito"
26 de setembro de 2019,50,Caranguejo,"Bom atendimento pelo metre Marciel, além da qualidade das comidas e dos Garçons que estão sempre atentos a nos servi ."
26 de setembro de 2019,50,Garçom Marcílio,"Atendimento muito bom, garçom muito prestativo, solícito e educado, comida boa, ambiente agradável,happy hour bom. Super indico!"
26 de setembro de 2019,50,Melhor caranguejo,"Melhor Maître Maciel,atendimento único,atencioso,uma culinária ímpar maravilhosa!!! Indico demais..."
26 de setembro de 2019,50,Melhor maitre,"Atendimento maravilhoso do maitre marciel e comida excelente. Super recomendo ambiente,atendimento e culinaria!!!!!"
26 de setembro de 2019,50,Almoço,"Excelente atendimento, fui atendido pelo Bahiano e o Maître Maciel, cardápio completo e cerveja gelada! Melhor restaurante de Fortaleza"
26 de setembro de 2019,50,Almoço a dois,"Tudo ótimo comida excelente, lugar agradável e atendimento impecável. Garçom Hermivan e maitre Maciel"
26 de setembro de 2019,50,Almoço com os amigos,Fomos atendidos pelo garçom Henrique e o maitre maciel. Comida muito boa. Recomendo o coco bambu sul.
26 de setembro de 2019,50,Almoço,Garcon eduardo e maitre Maciel atendimento de excelência comida boa espaço agradável recomendo coco bambu Sul
26 de setembro de 2019,50,"Aniversário, encontros","Melhor atendimento, rapidez, prestativos, bons preços. Jonatan e Henrique super atenciosos e simpáticos . Super recomendo"
25 de setembro de 2019,50,Melhor jantar de Fortaleza!,Atendimento top. Garcon Ronaldo Martins arroxado!! Juntamente com metri Maciel! Camarão grande. E 100%!
25 de setembro de 2019,50,Jantar,"Super indico a lasanha à bolonhesa, a massa super macia e bastante recheada, simplesmente uma delícia. O atendimento do garçom Ronaldo Martins impecável, nos sentimos muito bem acolhidos."
25 de setembro de 2019,50,Garçom Maia,"Atencioso, muito educado e bem qualificado na execussao do seu trabalho. Ótimo Atendimento! Ficamos muito satisfeitos!"
25 de setembro de 2019,50,Aniversário,"Ótimo atendimento do ronaldo e do pereira, comida e ambiente excelente! Música muito boa e preço acessível"
25 de setembro de 2019,50,Aniversário,"Fomos pra um aniversário e fomos atendidos pelo pereira e pelo ronaldo, foram muito atenciosos e simpaticos! Pedi uma salada italiana fresca e deliciosa. Nota dez"
25 de setembro de 2019,50,Jantar a Dois,Atendimento Extraordinário do Ronaldo e Maciel!!! O prato muito bem servido e veio muito rápido!!! Recomendo!!!
25 de setembro de 2019,50,Jantar do Romantismo,Excelente atendimento do garçom Ronaldo e do Maitre Maciel com ótimas dicas dos pratos! Fomos de Camarão Olinda ! Nota 1000 ! Recomendo sempre !
25 de setembro de 2019,50,Aniversário Eugênio brilhante,Ronaldo um Garson do coco banbum de um atendimento inigualável uma tenção maravilhosa vale a pena confiri amei parabéns
25 de setembro de 2019,40,Agradável,Pratos bem gostosos. Ambiente agradável. Com um parque muito grande para crianças. Os preços são razoáveis
25 de setembro de 2019,50,Comemoração de aniversário,"Viemos almoçar no meio da semana e tivemos um excelente atendimento com direito a bolinho simbólico e vela com parabéns! Obrigada, garçom Mendes e Maître Maciel! ❤️"
25 de setembro de 2019,50,Aniversário,Prato muito bom! Arroz Piamontese muito bom! Ótimo atendimento do Mendes e do Maitre Maciel! Recomendo!
25 de setembro de 2019,50,Aniversário!,Tivemos comemorando Meu aniversário e adoramos o atendimento do garçom Leonardo e do Maître Maciel. Recomendo!
25 de setembro de 2019,50,Comemoração de aniversário,Excelente atendimento do garçom Leonardo e do maître Maciel. Ambiente climatizado e é ideal para todas ocasiões. Comida maravilhosa e preço excepcional
25 de setembro de 2019,50,Aniversário,Comemorei meu aniversario e foi maravilhoso. Comida impecável! Atendimento incrivel feito pelo garçom Mendes e Maitre Maciel! Voltarei muitas outras vezes!
25 de setembro de 2019,50,Almoço,Comida e atendimento excelente. Metre Maciel Ambiente super agradável. Garçom Jhonatan bastante atencioso e prestativo
24 de setembro de 2019,50,Excelente!,Muito bem atendido pelo garçom Ronaldo Martins. Atendimento diferenciado. Tudo estava top.voltaremos com certeza
24 de setembro de 2019,50,Fortaleza 2019,"Excelente restaurante para conhecer em Fortaleza, ambiente agradável, excelente atendimento, comida fantástica, você não pode deixar de conhecer"
24 de setembro de 2019,50,Despedida de filha,"Pedimos como pratos o querido Câmarao Internacional e a Carne de sol sertaneja, ambos estavam ""dos deuses"". Recomendo! E ao atendimento super ágil e e especial do Ronaldo Martins, que nos surpreende com tamanha dedicação pelo o que faz."
23 de setembro de 2019,50,Recomendo demais,Atendimento excelente e o garçom Maia foi bem atencioso e eficiente. Estao de parabens pelo serviço.
23 de setembro de 2019,50,Vale a pena!,Já conheciamos o Coco Bambu em Vitória e hoje viemos ao de Fortaleza... impecável! Comida muito boa! Atendimento excelente pelo garçom Maia! Lugar super agradável!
23 de setembro de 2019,50,Jantar,"Comida muito top, e o atendimento excelente! Garçom Ronaldo é fera! Voltaremos outras vezes e recomendo"
23 de setembro de 2019,50,Jantar,"Ótimo garçom , Ronaldo Martins foi o melhor ate agora !!! Comida muito gostosa , excelente ambiente ! Vim ontem e ontem e foi ótimo"
23 de setembro de 2019,50,Friends,"Mega satisfeita pela indicação do prato indicado pelo Ronaldo Martins, obrigada por tanta excelência!"
23 de setembro de 2019,50,Almoco,Obrigado pela experiência maravilhosa . O atendimento faz toda diferença . Coco bambu sul continue fazendo a diferença no atendimento. Espero voltar mais . Adorei . A comida também vale a pena
23 de setembro de 2019,50,Almoço,"Camarao Tamandaré . Olha foi uma surpresa maravilhosa. A qualidade do prato e o atendimento atencioso do Ronaldo . Agora sim, posso dizer que definitivamente sou cliente coco bambu sul Obrigado"
23 de setembro de 2019,50,Almoço,Delícia de prato com e excelência de atendimento Ronaldo Martins e o mostre Maciel adorei tudo com certeza voltarei
23 de setembro de 2019,50,Almoço,Sempre viemos ao Coco Bambu e desta vez comemos o Bobó de Camarão. Um prato muito gostoso e que tem purê de abóbora! Fomos muito bem atendidas pelo Ronaldo Martins e o maitre Marciel.
23 de setembro de 2019,50,Almoço,Almoço excelente no Coco Bambu Sul!! Deliciosos Camarão Tamandaré e Carne de Sol Sertaneja curtindo boa música e atendimento perfeito do garçom Ronaldo Martins juntamente com o maître Maciel!
22 de setembro de 2019,50,Aniversário,"Lugar altamente agradável, atendimento excelente, comida maravilhosa. Eric, Bruno, Celio e Maciel fizeram atendimento diferenciado. Muito obrigada mais uma vez pela atenção, carinho e dedicação de sempre. Super indico."
22 de setembro de 2019,50,Jantar,"Ótimo atendimento feito pelo Rafael e a comida muito boa, fizemos um momento de confraternização e fomos muito bem recebidos."
22 de setembro de 2019,50,Ótima avaliação,"Ótimo atendimento! Maître Maciel super atencioso! Comida de qualidade! Ambiente aconchegante, a reforma do salão ficou excelente!"
22 de setembro de 2019,50,Excelente ambiente,"Atendimento excelente garçom Marcílio atencioso e Cortez, preço justo, gastronomia encantadora, mega recomendo"
22 de setembro de 2019,50,Niver bambam,Pedimos o prato “camarão internacional” e “ sertanejo” ambos são fartos e gostosos. Fomos muito bem atendidos pelo Ronaldo Martins excelente tanto o Ronaldo como o maître marciel
22 de setembro de 2019,50,Almoço,"Parabéns pela excelente comida e atendimento. O garçom Ronaldo Martins, juntamente com o Metri Massiel"
22 de setembro de 2019,50,Coco Bambu Sul,"Almoço excelente e atendimento do garçom Ronaldo Martins e metre Maciel impecável, voltarei com certeza."
21 de setembro de 2019,50,Quinta do caranguejo,"Fomos ao Coco Bambu Sul quinta feira e pedimos caranguejo que estava muito bom que pena que acabou cedo, o maitre Maciel super atencioso fez a diferença voltaremos logo."
21 de setembro de 2019,50,Espetacular,Atendimento muito bom e comida maravilhosa. Metre Maciel super atencioso e prestativo. Com certeza voltaremos.
21 de setembro de 2019,50,Jantar de amigos,Excelente atendimento! Ambiente agradável e música ao vivo. Recomendado! Procurem o garçom Ronaldo Martins
21 de setembro de 2019,50,Jantar,O Garçon Ronaldo Martins prestou um excelente atendimento. Parabéns pela dedicação pelo profissionalismo e excelência.
21 de setembro de 2019,50,Jantar em familia,Excelente atendimento do garçom Ronaldo Martins. Cerveja geladíssima e pratos deliciosos. Ainda tem o parquinho pra satisfazer nossa filha! Adoramos.
21 de setembro de 2019,50,Jantar,"O sr ronaldo martins alem de ser um fofo, ele é cordial, trata vc super bem e indica os melhores pratos. Fomos muito bem tratados, e a comida estava deliciosa."
21 de setembro de 2019,50,Ótimo atendimento,"Comida muito boa e farta. Metre Marciel muito atencioso, nos atendeu super bem. Música ao vivo de ótima qualidade."
21 de setembro de 2019,50,Almoço,Camarao internacional Filé parmegiana Atendimento excelente Garçom super atencioso Ronaldo Martins recomendo
21 de setembro de 2019,50,Almoço,"Garçom Ronaldo Martins extremamente atencioso. Fiquei surpreso com a qualidade do prato que pedi, peixe pizzaiolo. Recomendo fortemente."
21 de setembro de 2019,50,Sexta com amigos,"Estive com um grupo de amigos para nosso encontro semanal, escolhemos o cocô bambu por ser um local tranquilo e agradável... deixar meus agradecimentos em especial ao garçom Leandro que nos atendeu com simpatia e satisfação. Excelente profissional. Recomendo."
21 de setembro de 2019,50,Almoço,"Comida maravilhosa... Referencia em camarão! Ademais, o atendimento é excelente, com destaque para o garçom Ronaldo Martins."
21 de setembro de 2019,50,Almoço,"Atendimento P E R F E I T O pelo Sr. ARI. SUPER RECOMENDO O ATENDENTE. Restaurante com ambiente ,agradavel"
20 de setembro de 2019,50,Jantar,Pratos excelentes e atendimento ótimo pelos garçom Ronaldo e metri Macielvrecomendo com certeza a todos.
20 de setembro de 2019,50,Aniversário,"Ressalto o atendimento do garçom Mendes como exemplar, extremamente dedicado! Parabéns pelo serviço!"
20 de setembro de 2019,50,Atendimento impecável,"Comidas excelentes e o atendimento do garçom Mendes foi sensacional! Paciente, cordial e muito afetuoso! Parabéns!"
20 de setembro de 2019,50,Jantar,"Comida saborosa preço justo e um atendimento impecável do garçom Ronaldo Martins e do mâitre marcial, super recomendo"
20 de setembro de 2019,50,amigos,"atendimento muito bom, o nosso garçom ronaldo e maciel foram excelentes, além de uma deliciosa comida oferecia a nos"
20 de setembro de 2019,50,Camarãozinho Olinda,"Comida muito boa, Ronaldo e Maciel se garantem demais tem que ganhar um aumento muito gente boa os cara"
20 de setembro de 2019,50,Almoço com amigos,"Muito bom, garçom atencioso - Ronaldo , e meitre maciel, comida como sempre boa, ambiente agradável."
20 de setembro de 2019,50,Almoço com os amigos do colégio,"Fomos muito bem atendidos pelo garçom Ronaldo, e o gerente Maciel foi excelente! Ótimo serviço, recomendo!"
20 de setembro de 2019,50,almoço com amigos,"atendimento muito bom do eduardo, comida boa e amniente muito bom, pratos executivos com um bom preço"
20 de setembro de 2019,50,Almoço,"Excelente , onde o atendimento em geral foi de maneira extremamente atenciosa em todos os aspectos ( Eduardo)"
20 de setembro de 2019,50,Almoço com a patroa,Almocei um camarão Olinda muito bom por sinal.... e um atendimento diferenciado faz toda a diferença atendimento feito pelo garçom Ronaldo Martins
19 de setembro de 2019,50,Melhor caranguejo,"O caranguejo estava super top, excelente o melhor que já comi ótimo atendimento do maître Maciel e do garçom Rafael"
19 de setembro de 2019,50,Melhor caranguejo,Vim aqui com a família um bom atendimento e o melhor caranguejo atendimento Leonardo e maître marciel
19 de setembro de 2019,50,Melhor caranguejo da vida!!,"O melhor restaurante, com a melhor comida e atendimento, agora com o melhor caranguejo!!!! Atendimento super atencioso do Maitre Maciel!!!"
19 de setembro de 2019,50,Jantar a dois,Atendimento maître Maciel e garçon Jonathan super atenciosos com ótimas sugestões de entrada cerveja super gelada tudo perfeito
19 de setembro de 2019,40,Muito bom,"De todas vezes que estive neste restaurante, apenas uma vez não sai satisfeito. Bom ambiente, limpo, pessoal atencioso, comida na maioria das vezes excelente. Pratos bem servidos, podendo ser mais repartidos por quem come pouco ou quer economizar. Boas opções."
18 de setembro de 2019,50,Garçom Marcilio,"O antedimento do Marcílio muito eficiente,comida maravilhosa, músicas boas ambiente muito agradável nota dez para o antedimento do Marcílio."
18 de setembro de 2019,50,Garçom Marcilio,"Excelente antedimento , comida espetacular, sem falar no ambiente, garçom muito antecioso e prestantivo"
18 de setembro de 2019,50,Evento Coveli/RBL,Nota 10 para o atendimento do meu amigo Maciel e sua equipe. Camarão dos melhores que já comi. Recomendo com certeza.
18 de setembro de 2019,50,Garçom Marcílio,"Excelente atendimento, ambiente agradável. Depois da reforma, ficou muito boa a estrutura da casa. Recomendo!"
18 de setembro de 2019,50,Evento RBL,Excelente atendimento e suporte. Evento organizado e com suporte. Local limpo e comida excelente. Maitre Maciel e garson Maya.
18 de setembro de 2019,50,Evento RBL,"Fui convidado para um evento de negócios da empresa RBL e fiquei muito satisfeito com o ambiente, comidas e atendimento do Coco Bambu Sul, em especial o Maitre Maciel."
18 de setembro de 2019,50,Garçom Marcílio,"Excelente atendimento, comida muito boa, ambiente agradável, tudo perfeito! Voltaremos com certeza!!"
18 de setembro de 2019,50,Jantar,Camarão Olinda é o prato! Serve muito bem e é absolutamente delicioso. Atendimento do garçom Ronaldo Martins foi top. Só cerveja canela de pedreiro!!
18 de setembro de 2019,50,Aniversario,Ótimo atendimento do profissional Ronaldo Martins. Os pratos muito bem servidos e no preço justo. Obrigado
18 de setembro de 2019,50,Niver da Dayse,Comida top e atendimento muito top do garçom Ronaldo Martins e do Sr Freire ! Recomendo! Com ctz voltaremos.
18 de setembro de 2019,50,Evento RBL,"Convite realizado pela RBL no restaurante Coco Bambu, ambiente agradavel, com bom atendimento com Maitre Maciel e comida exelente."
18 de setembro de 2019,50,Almoço,O atendimento do garçom Ronaldo Martins excelente e o prato uma delicia . Recomendo e voltarei com certeza!!
18 de setembro de 2019,50,Almoço,Atendimento do Ronaldo e Jonatan 100%. Prato ótimo ! Cerveja gelada... Recomendo voltarei com certeza....
18 de setembro de 2019,50,Almoço,"Pratos muito bons ( filet com ervas, camarão internacional e camarão à milanesa) e um ótimo atendimento do garçom Renato Martins"
18 de setembro de 2019,50,Marcílio,Ótimo atendimento. Garçom sempre atento aos nossos pedidos. A comida excelente e não demorou muito para chegar! Recomendo !
18 de setembro de 2019,50,JANTAR,"Comida saborosa, preço justo e ótimo atendimento do garçom Maia. Espaço está maravilhoso com as reformas que fizeram."
17 de setembro de 2019,50,Jantar,"O prato escolhido estava excelente, o atendimento representado pelos garçons Ronaldo Martins e Fernando correspondeu as expectativas."
17 de setembro de 2019,50,Aniversário,"Garçom Ronaldo Martins foi muito atencioso , top demais !!! A coisa maravilhosa ambiente muito agradável"
17 de setembro de 2019,50,Aniversário,Gostaria de parabenizar pelo excelente atendimento do garçom Ronaldo Martins. Recomendo a todos os amigos.
17 de setembro de 2019,50,jantar,"Pratos bom, parquinho para criancada. Garcom Ronaldo Martins e Fernando, nota 1000. voltaremos com certeza"
17 de setembro de 2019,40,Atendimento top,"Garçom Marcílio nos atendeu muito bem. Voltaremos com certeza! Comida boa, ambiente agradável e preço justo."
17 de setembro de 2019,50,Jantar,"Prato muito bom, o garçom Ronaldo Martins atendeu muito bem. Comemos o peixe jeri estava maravilhoso. Voltaremos"
17 de setembro de 2019,50,Aniversário renan,Sem duvida uma ótima comida e um excelente atendimento . Inesquecível . Servido pelo garçom Ari e gerente marciel . 100%.
17 de setembro de 2019,50,Aniversário surpresa Renan Vieira,"Atendimento de excelência, pelo maitre Maciel e o Garçom Ari, sem duvidas uma grande pedida em nossa cidade!! Vale a pena conferir!!!"
17 de setembro de 2019,50,Aniversário do Renan,"Viemos comemorar o aniversário surpresa do nosso amigo Renan. Local muito bom,ambiente agradável, atendimento excelente, em especial do garçom Ari e Maciel."
17 de setembro de 2019,50,Aniversário surpresa do Renan,Comida muito saborosa e gostosa Atendimento eficiente e garçons muito atenciosos Ambiente muito agradável :)
17 de setembro de 2019,50,Aniv do Renan,"Foi tudo ótimo, comida maravilhosa Atendimento excelente Marciel e Ari fizeram um ótimo atendimento."
17 de setembro de 2019,50,Aniversário Surpresa do Renan,Ambiente agradável Comida muito gostosa e bem servida Atendimento muito bom pelo Maciel e Ari Recomeço
17 de setembro de 2019,50,Aniversário do Renan,"Ambiente agradável,excelente atendimento, comida muito boa, local muito bom para trazer as crianças ❤️ Maître Maciel e garçom Ari"
17 de setembro de 2019,50,Aniver do Renan,Maitre Maciel e garçom Ari ofereceram um ótimo atendimento!!! Ameiii❤️❤️❤️ O restaurante serve comidas com qualidade excepcional. Recomendo 1000 vezes!
17 de setembro de 2019,50,Aniversário do Renan,Maître Maciel e O Garçom Ari nos atenderam maravilhosamente bem!! Sempre um bom lugar para comemorações!
